department_en;org_id;fiscal_yr;service_id;service_name_en;service_name_fr;service_standard_id;service_standard_en;service_standard_fr;volume_meeting_target;total_volume;performance;issue;description_en;action_en;description_fr;action_fr
Canada Energy Regulator;221;2023-2024;2014;Canada Energy Regulator Financial Audit of Regulated Companies.;Vérification des états financiers des sociétés réglementées par la Régie de l'énergie du Canada.;2534;Percentage of draft financial reports will be sent to the audited company within 8 weeks of completing field work;Pourcentage des rapports préliminaires d’audit des états financiers sont transmis aux sociétés concernées dans les 8 semaines suivant la fin des travaux sur le terrain;0;0;;qa_no_ss_volume;There is no volume being reported for this service standard;Remove service standards that do not track performance;Aucune information volumétrique n'est rapportée pour cette norme de service.;Supprimer les normes de service qui ne rapportent pas leur rendement
Canada Energy Regulator;221;2023-2024;2014;Canada Energy Regulator Financial Audit of Regulated Companies.;Vérification des états financiers des sociétés réglementées par la Régie de l'énergie du Canada.;2535;Percentage of final financial audit reports will be sent to company within 3 weeks of receiving the audited company’s comments on the draft financial report;Pourcentage des rapports finaux d’audit des états financiers sont transmis aux sociétés concernées dans les 3 semaines suivant la réception de leurs commentaires sur le rapport préliminaire;0;0;;qa_no_ss_volume;There is no volume being reported for this service standard;Remove service standards that do not track performance;Aucune information volumétrique n'est rapportée pour cette norme de service.;Supprimer les normes de service qui ne rapportent pas leur rendement
Canada Energy Regulator;221;2023-2024;290;Processing Applications for Long-term Export License;Traitement des demandes présentées pour licence d'exportation à long terme;247;Percentage of applications made under the National Energy Board Act, Part VI or the Canadian Energy Regulator Act, Part 7 that are processed within 6 months after the day on which an applicant has, in the Board’s/Commission's opinion, provided a complete application for long-term export license.;Pourcentage de demandes présentées aux termes de la partie VI de la loi sur l'Office national de l'énergie ou de la partie 7 de la loi sur la Régie canadienne de l’énergie traitées dans les six mois à compter de la date à laquelle le demandeur a, de l'avis de l’Office ou de la Commission, présenté une demande complète pour une licence d’exportation à long terme.;0;0;;qa_no_ss_volume;There is no volume being reported for this service standard;Remove service standards that do not track performance;Aucune information volumétrique n'est rapportée pour cette norme de service.;Supprimer les normes de service qui ne rapportent pas leur rendement
Canada Energy Regulator;221;2023-2024;296;Processing Landowner Complaints;Règlement des plaintes des propriétaires fonciers;230;Percentage of level 1 complaints resolved or closed within 21 calendar days of received date.;Pourcentage des plaintes relatives à des questions foncières de niveau 1 réglées ou closes dans les 21 jours civils suivant la date de la réception.;0;0;;qa_no_ss_volume;There is no volume being reported for this service standard;Remove service standards that do not track performance;Aucune information volumétrique n'est rapportée pour cette norme de service.;Supprimer les normes de service qui ne rapportent pas leur rendement
Canada Energy Regulator;221;2023-2024;299;Processing Canada Oil and Gas Operations Act Applications;Traitement des demandes aux termes de la Loi sur les opérations pétrolières au Canada;235;Percentage of decisions for well drilling applications rendered within 21 calendar days of receiving a complete application.;Pourcenatge des decisions relatives aux demandes de forage de puits rendues dans les 21 jours civils suivant la réception de la demande complète.;0;0;;qa_no_ss_volume;There is no volume being reported for this service standard;Remove service standards that do not track performance;Aucune information volumétrique n'est rapportée pour cette norme de service.;Supprimer les normes de service qui ne rapportent pas leur rendement
Canada Energy Regulator;221;2023-2024;299;Processing Canada Oil and Gas Operations Act Applications;Traitement des demandes aux termes de la Loi sur les opérations pétrolières au Canada;258;Percentage of decisions for Geological and Geophysical Applications rendered within 30 calendar days of receiving a complete application.;Pourcentage des décisions aux demandes visant des activités géologiques et géophysiques rendues dans les 30 jours civils suivant la réception de la demande complète.;0;0;;qa_no_ss_volume;There is no volume being reported for this service standard;Remove service standards that do not track performance;Aucune information volumétrique n'est rapportée pour cette norme de service.;Supprimer les normes de service qui ne rapportent pas leur rendement
Canada Energy Regulator;221;2023-2024;304;Processing Canada Petroleum Resources Act Applications;Traitement des demandes aux termes de la Loi fédérale sur les hydrocarbures;233;Percentage of decisions for Significant Discovery Applications on frontier lands rendered within 90 calendar days from the day all information is available to begin the evaluation process.;Pourcentage des decisions relatives aux découvertes importantes dans les régions pionnières rendues dans un délai de 90 jours civils à compter de la date à laquelle toute l'information a été obtenue pour entreprendre l'évaluation.;0;0;;qa_no_ss_volume;There is no volume being reported for this service standard;Remove service standards that do not track performance;Aucune information volumétrique n'est rapportée pour cette norme de service.;Supprimer les normes de service qui ne rapportent pas leur rendement
Canada Energy Regulator;221;2023-2024;304;Processing Canada Petroleum Resources Act Applications;Traitement des demandes aux termes de la Loi fédérale sur les hydrocarbures;256;Percent of decisions for Commercial Discovery Applications on frontier lands rendered within 90 calendar days from the day all information is available to begin the evaluation process.;Pourcentage des décisions relatives aux demandes pour des découvertes exploitables dans les régions pionnières rendues dans un délai de 90 jours civils à compter de la date à laquelle toute l'information a été obtenue pour entreprendre l'évaluation.;0;0;;qa_no_ss_volume;There is no volume being reported for this service standard;Remove service standards that do not track performance;Aucune information volumétrique n'est rapportée pour cette norme de service.;Supprimer les normes de service qui ne rapportent pas leur rendement
Canada Revenue Agency;46;2023-2024;1139;"Individual Tax Enquiries 
(Contact Centre)";Demandes de renseignements sur l'impôt des particuliers (Centre de contact);STAN00003912;Our goal is to respond to your call within 15 minutes or less of opting to speak with an agent.;Notre objectif est de répondre à votre appel téléphonique dans un délai de 15 minutes ou moins à partir du moment où vous choisissez de parler à un agent.;0;8545875;0.0;qa_duplicate_stdid;This service standard id has already been assigned to a different standard;Request new service standard IDs from the service policy team, resubmit with the new ID, delete the old record;Cet identifiant de norme de service est déja assigné à une autre norme de service;Demander un nouvel identifiant de norme de service de l'équipe de politique de service, re-soumettre cette rangée avec le nouvel identifiant, supprimer la vielle rangée
Canada Revenue Agency;46;2023-2024;1141;"Business Enquiries 
(Contact Centre)";Demandes de renseignements des entreprises (Centre de contact);STAN00003912;Our goal is to respond to your call within 15 minutes or less of opting to speak with an agent.;Notre objectif est de répondre à votre appel téléphonique dans un délai de 15 minutes ou moins à partir du moment où vous choisissez de parler à un agent.;0;2259557;0.0;qa_duplicate_stdid;This service standard id has already been assigned to a different standard;Request new service standard IDs from the service policy team, resubmit with the new ID, delete the old record;Cet identifiant de norme de service est déja assigné à une autre norme de service;Demander un nouvel identifiant de norme de service de l'équipe de politique de service, re-soumettre cette rangée avec le nouvel identifiant, supprimer la vielle rangée
Canada Revenue Agency;46;2023-2024;3710;Deferred Income and savings plans specimens reviews;Régimes de revenu différé et d’épargne (spécimens);STAN00006273;Our goal is to respond to a written enquiry within 60 calendar days of receiving your enquiry and any required supporting documents.;Notre objectif est de répondre à une demande de renseignements écrite dans un délai de 60 jours civils suivant la réception de votre demande et des pièces justificatives requises.;0;0;;qa_no_ss_volume;There is no volume being reported for this service standard;Remove service standards that do not track performance;Aucune information volumétrique n'est rapportée pour cette norme de service.;Supprimer les normes de service qui ne rapportent pas leur rendement
Canadian Food Inspection Agency;65;2023-2024;2;Import Live Animal, Hatching Eggs and Germplasm (Semen and Embryos);Importation d'animaux vivants, d'oeufs d'incubation et de germoplasme d'animaux;3716;Import Live Animals;Importation des animaux;3177;3068;1.0355;qa_performance_over_100;The volume of interactions meeting the target exceeds the total volume, indicating a service standard performance over 100%.;Correct the volumes listed for 'total_volume' and 'volume_meeting_target';Le volume d'intéractions qui ont atteint la cible dépasse le volume total d'intéractions, ce qui indique un rendement de la norme de service supérieur à 100%.;Corriger les montants inscrits pour le volume total (total_volume) et le volume qui a atteint la cible (volume_meeting_target)
Canadian Grain Commission;69;2023-2024;1991;Harvest Sample Crop Quality Results (Unofficial Results);Programme d'échantillons de récolte (résultats non officiels);2497;Results are available within 20 business days from when the Canadian Grain Commission receives your samples.;Les résultats sont offerts dans les 20 jours ouvrables suivant la réception des échantillons par la Commission canadienne des grains.;9903;9873;1.003;qa_performance_over_100;The volume of interactions meeting the target exceeds the total volume, indicating a service standard performance over 100%.;Correct the volumes listed for 'total_volume' and 'volume_meeting_target';Le volume d'intéractions qui ont atteint la cible dépasse le volume total d'intéractions, ce qui indique un rendement de la norme de service supérieur à 100%.;Corriger les montants inscrits pour le volume total (total_volume) et le volume qui a atteint la cible (volume_meeting_target)
Canadian Radio-television and Telecommunications Commission;93;2023-2024;1887;Client Services;Services à la clientèle;2190;"Telephone, TTY and chats: Mon to Fri, 8:30 a.m. to noon and 1:00 p.m. to 4:30 p.m. ET; Social media: Mon to Fri, 8:30 a.m. to noon and 1:00 p.m. to 4:30 p.m. ET; Online Support Centre available 24/7; Inquiries via email and webform within 10 business days; Voicemails: callbacks within 48 hours";"Téléphone, téléscripteur et clavardage : lun au ven, 8h30 à midi et de 13h00 à 16h30 HE; Médias sociaux,  lun au ven, 8h30 à midi et de 13h00 à 16h30 HE; Centre de soutien en ligne en tout temps; Courriel et formulaire en ligne délai de 10 jours ouvrables;  Messages vocaux : délai de 48 heures";0;0;;qa_no_ss_volume;There is no volume being reported for this service standard;Remove service standards that do not track performance;Aucune information volumétrique n'est rapportée pour cette norme de service.;Supprimer les normes de service qui ne rapportent pas leur rendement
Canadian Space Agency;95;2023-2024;1671;Canadian Space Agency Class Grants and Contributions Program;Programme global des subventions et contributions de l'Agence spatiale canadienne;STAN00005280;The applicant will receive an acknowledgement of receipt within a maximum of 2 weeks following receipt of the application.;Le demandeur va recevoir un accusé réception dans un maximum de 2 semaines suivant la réception de sa demande.;0;0;;qa_no_ss_volume;There is no volume being reported for this service standard;Remove service standards that do not track performance;Aucune information volumétrique n'est rapportée pour cette norme de service.;Supprimer les normes de service qui ne rapportent pas leur rendement
Canadian Space Agency;95;2023-2024;1671;Canadian Space Agency Class Grants and Contributions Program;Programme global des subventions et contributions de l'Agence spatiale canadienne;STAN00005281;The applicant will receive a selection decision in a maximum of 26 to 46 weeks (Research component), a maximum of 18 weeks (Awareness and Education component).;Le demandeur va recevoir une décision de sélection dans un maximum de 26 à 46 semaines (volet Recherche), maximum de 18 semaines (volet sensibilisation et éducation);0;0;;qa_no_ss_volume;There is no volume being reported for this service standard;Remove service standards that do not track performance;Aucune information volumétrique n'est rapportée pour cette norme de service.;Supprimer les normes de service qui ne rapportent pas leur rendement
Canadian Space Agency;95;2023-2024;1671;Canadian Space Agency Class Grants and Contributions Program;Programme global des subventions et contributions de l'Agence spatiale canadienne;STAN00005283;The applicant will receive the issuance of payment within 4 weeks for a grant and 6 weeks for a contribution;Le demandeur va recevoir l'émission du paiement dans les 4 semaines pour une subvention et dans 6 semaines pour une contribution;0;0;;qa_no_ss_volume;There is no volume being reported for this service standard;Remove service standards that do not track performance;Aucune information volumétrique n'est rapportée pour cette norme de service.;Supprimer les normes de service qui ne rapportent pas leur rendement
Canadian Space Agency;95;2023-2024;3638;Stratospheric Balloon Flight Opportunities (STRATOS);Opportunités de vols de ballons stratosphériques (STRATOS);8620;An answer is provided within 14 business following the request.;Une réponse est fournie dans les 14 jours ouvrables suivant la demande;0;0;;qa_no_ss_volume;There is no volume being reported for this service standard;Remove service standards that do not track performance;Aucune information volumétrique n'est rapportée pour cette norme de service.;Supprimer les normes de service qui ne rapportent pas leur rendement
Canadian Space Agency;95;2023-2024;SRV02873;Transfer and diffusion of space technology;Diffusion et transfert de technologies spatiales;STAN00005264;10 working days, acknowledgment of receipt following receipt of the customer's email;10 jours ouvrables, accusé de réception suivant la réception du courriel du client.;0;0;;qa_no_ss_volume;There is no volume being reported for this service standard;Remove service standards that do not track performance;Aucune information volumétrique n'est rapportée pour cette norme de service.;Supprimer les normes de service qui ne rapportent pas leur rendement
Canadian Space Agency;95;2023-2024;SRV03429;Core geospatial observation sites in remote locations of Canada (GO Canada);Sites de base d'observation géospatiale en régions éloignées du Canada (GO Canada);8729;No service standard established.;Aucune norme de service établie;0;0;;qa_no_ss_volume;There is no volume being reported for this service standard;Remove service standards that do not track performance;Aucune information volumétrique n'est rapportée pour cette norme de service.;Supprimer les normes de service qui ne rapportent pas leur rendement
Canadian Space Agency;95;2023-2024;SRV03434;Ground support for space science (THEMIS);Soutien au sol des sciences spatiales (THEMIS);8727;No service standard established.;Aucune norme de service établie;0;0;;qa_no_ss_volume;There is no volume being reported for this service standard;Remove service standards that do not track performance;Aucune information volumétrique n'est rapportée pour cette norme de service.;Supprimer les normes de service qui ne rapportent pas leur rendement
Canadian Transportation Agency;99;2023-2024;165;Dispute Resolution;Règlement des Différends;139;Percentage of air consumer protection disputes resolved within service standards;Pourcentage de différends relatifs à la protection des consommateurs dans le domaine du transport aérien qui ont été réglés en conformité avec les normes de services établies;0;0;;qa_no_ss_volume;There is no volume being reported for this service standard;Remove service standards that do not track performance;Aucune information volumétrique n'est rapportée pour cette norme de service.;Supprimer les normes de service qui ne rapportent pas leur rendement
Communications Security Establishment Canada;110;2023-2024;3181;Cyber Defence Services;Services de cyberdéfense;5913;Remain accessible to provide custom advice and guidance to federal institutions. CCID is accessible to respond to requests from 8 am - 4 pm (Eastern Standard Time) on all working days.;Demeurer accessible pour fournir des conseils et des recommandations en matière de cyberdéfense. Le CCID est accessible pour répondre aux demandes tous les jours ouvrables de 8 h à 16 h (heure normale de l’Est).;0;0;;qa_no_ss_volume;There is no volume being reported for this service standard;Remove service standards that do not track performance;Aucune information volumétrique n'est rapportée pour cette norme de service.;Supprimer les normes de service qui ne rapportent pas leur rendement
Communications Security Establishment Canada;110;2023-2024;3413;Access to Information and Priavacy - Privacy Act;Accès à l’information et protection des renseignements personnels - Loi sur la protection des renseignements personnels;5909;Timeframe for responding to a Privacy Act request is 30 days. The Act allows for legal extensions to this first 30 calendar-day response;Le délai pour répondre à une demande en vertu de la Loi sur la protection des renseignements personnels est de 30 jours. La Loi autorise des prolongations légales de ce premier délai de réponse de 30 jours civils.;52;33;1.5758;qa_performance_over_100;The volume of interactions meeting the target exceeds the total volume, indicating a service standard performance over 100%.;Correct the volumes listed for 'total_volume' and 'volume_meeting_target';Le volume d'intéractions qui ont atteint la cible dépasse le volume total d'intéractions, ce qui indique un rendement de la norme de service supérieur à 100%.;Corriger les montants inscrits pour le volume total (total_volume) et le volume qui a atteint la cible (volume_meeting_target)
Communications Security Establishment Canada;110;2023-2024;3414;Access to Information and Privacy - Access to Information;Accès à l’information et protection des renseignements personnels - Loi sur l'accès à l'information;5910;Timeframe for responding to an Access to Information Act request is 30 days. The Act allows for legal extensions to this first 30 calendar-day response.;Le délai pour répondre à une demande en vertu de la Loi sur l’accès à l’information est de 30 jours. La Loi autorise des prolongations légales de ce premier délai de réponse de 30 jours civils.;30;21;1.4286;qa_performance_over_100;The volume of interactions meeting the target exceeds the total volume, indicating a service standard performance over 100%.;Correct the volumes listed for 'total_volume' and 'volume_meeting_target';Le volume d'intéractions qui ont atteint la cible dépasse le volume total d'intéractions, ce qui indique un rendement de la norme de service supérieur à 100%.;Corriger les montants inscrits pour le volume total (total_volume) et le volume qui a atteint la cible (volume_meeting_target)
Copyright Board Canada;114;2023-2024;1119;Copyright Tariff Setting;Établissement de tarifs liés au droit d’auteur;3961;Percentage of tariff decisions published within 12 months;Pourcentage de décisions relatives aux tarifs publiées dans un délai d’au plus 12 mois;0;0;;qa_no_ss_volume;There is no volume being reported for this service standard;Remove service standards that do not track performance;Aucune information volumétrique n'est rapportée pour cette norme de service.;Supprimer les normes de service qui ne rapportent pas leur rendement
Copyright Board Canada;114;2023-2024;1120;Issuance of licences for the use of copyright works when the owner is unlocatable;Délivrance de licences pour les oeuvres protégées par un droit d'auteur lorsque le titulaire est introuvable;1073;Licences are issued within 45 days once the file is considered complete;Les licences sont délivrées dans un délai de 45 jours une fois le dossier considéré complet;0;0;;qa_no_ss_volume;There is no volume being reported for this service standard;Remove service standards that do not track performance;Aucune information volumétrique n'est rapportée pour cette norme de service.;Supprimer les normes de service qui ne rapportent pas leur rendement
Correctional Service Canada;117;2023-2024;155;CSC National Victim Services Program;Programme national de services aux victims du SCC;974;Notify registered victims of an offender’s conditional release 14 or more calendar days in advance.;Aviser les victimes inscrites de la libération conditionnelle d’un délinquant au moins 14 jours civils à l’avance.;0;0;;qa_no_ss_volume;There is no volume being reported for this service standard;Remove service standards that do not track performance;Aucune information volumétrique n'est rapportée pour cette norme de service.;Supprimer les normes de service qui ne rapportent pas leur rendement
Correctional Service Canada;117;2023-2024;155;CSC National Victim Services Program;Programme national de services aux victims du SCC;975;Notify registered victims of an offender’s conditional release 14 or more calendar days in advance.;Aviser les victimes inscrites de la libération conditionnelle d’un délinquant au moins 14 jours civils à l’avance.;0;0;;qa_no_ss_volume;There is no volume being reported for this service standard;Remove service standards that do not track performance;Aucune information volumétrique n'est rapportée pour cette norme de service.;Supprimer les normes de service qui ne rapportent pas leur rendement
Correctional Service Canada;117;2023-2024;155;CSC National Victim Services Program;Programme national de services aux victims du SCC;980;Notify registered victims of an offender’s transfer to a minimum-security facility 3 or more calendar days in advance.;Aviser les victimes inscrites du transfèrement d’un délinquant vers un établissement à sécurité minimale au moins trois jours civils à l’avance.;0;0;;qa_no_ss_volume;There is no volume being reported for this service standard;Remove service standards that do not track performance;Aucune information volumétrique n'est rapportée pour cette norme de service.;Supprimer les normes de service qui ne rapportent pas leur rendement
Correctional Service Canada;117;2023-2024;160;Information Services;Services d'information;STAN00005164;Number of media queries answered within timelines given by requestor(s).;Nombre de demandes de renseignements des médias auxquelles on a répondu dans les délais prescrits par le demandeur .;0;0;;qa_no_ss_volume;There is no volume being reported for this service standard;Remove service standards that do not track performance;Aucune information volumétrique n'est rapportée pour cette norme de service.;Supprimer les normes de service qui ne rapportent pas leur rendement
Crown-Indigenous Relations and Northern Affairs Canada;129;2023-2024;1134;Aboriginal and Treaty Rights Information System (ATRIS) and Training on using the system.;Système d'information sur les droits ancestraux et issus de traités (SIDAIT) et formation sur l'utilisation du système.;STAN00005305;The ATRIS website is available to all Canadians. ATRIS training is available to all Canadians. They can choose to take the training in either English or in French.;Aucune norme de service existe actuellement. Le site web de SIDAIT est accessible à tous les Canadiens. La formation sur SIDAIT est disponible pour tous les Canadiens. Ils peuvent choisir de suivre la formation en anglais ou en français.;0;0;;qa_no_ss_volume;There is no volume being reported for this service standard;Remove service standards that do not track performance;Aucune information volumétrique n'est rapportée pour cette norme de service.;Supprimer les normes de service qui ne rapportent pas leur rendement
